url,status,error,keywords,business_name,products_services,target_audience,location,headers,emails,phones,top_competitors,gmb_setup,non_indexed_pages
url,error,"Error scraping https://url: HTTPSConnectionPool(host='url', port=443): Max retries exceeded with url: / (Caused by NameResolutionError(""<urllib3.connection.HTTPSConnection object at 0x7f4183a8b880>: Failed to resolve 'url' ([Errno -3] Temporary failure in name resolution)""))",,,,,,,,,,,
sanjosebengalcats.com,success,,"['bengal cat breeders san jose', 'exotic feline companion bengal cats for sale', 'bengal kittens available for adoption', 'buy bengal cats from reputable breeder', 'adopting a bengal kitten from san jose']",San Jose Bengal Cats,"Bengal Kittens, Bengal Adults, Vaccinations, Dewormings, 2 Year Genetic Health Guarantee, Pedigree Paperwork, Health Checked by Licensed Veterinarian","Individuals and families seeking a unique, intelligent, and affectionate pet; demographics: cat enthusiasts, first-time owners, Bengal enthusiasts; intent: to adopt a healthy, well-socialized Bengal kitten or adult cat as a companion.","San Jose, California",[],['rene@sanjosebengalcats.com'],[],"['https://thebengalconnection.com', 'http://www.sanjosebengalcats.com', 'https://www.mapquest.com', 'https://quality-bengal-kittens.com', 'https://petnax.com']",False,7020.0
peachmarketplace.com,success,,"['halloween shirts', 'fall clothing', 'pumpkin t-shirts', 'leopard print tops', 'holiday hoodies']",Peach Marketplace,"T-shirts, Hoodies, Tops and Dresses, Embroidery Accessories","Individuals seeking casual, festive clothing for fall and Halloween seasons.",United States,[],[],[],"['https://www.amazon.com', 'https://www.halloweenshirtcompany.com', 'https://oldnavy.gap.com', 'https://www.etsy.com', 'https://www.youtube.com']",True,337.0
peachmcintyre.com,success,,"['social media content creator course', 'online content creation mentorship program', '7 day content creator group mentorship', 'turn internet into income online', 'social media marketing training']",Peach McIntyre Inc.,"Mentor Me Peach 7 Day Content Creator Group Mentorship Program, Social Media Content Creation Courses",Entrepreneurs and small business owners seeking online content creation skills to turn the internet into income,United States,[],"['support@peachmcintyre.com', 'Inc.813.797.1396support@peachmcintyre.com']",[''],"['https://www.youtube.com', 'https://www.udemy.com', 'https://www.hubspot.com', 'https://und.edu', 'https://www.coursera.org']",True,160.0
peachmedical.com,success,,"['COVID-19 test kits', 'rapid antigen tests at home', 'point of care testing products', 'over the counter antigen test kits', 'quickvue rsv test']",Peach Medical,"Lucira, BinaxNow, QuickVue, Indicaid, iHealth COVID-19/Flu A&B Rapid Test, Point of Care Products (POCT), Over The Counter Antigen Test Kits","Individuals and families seeking rapid diagnostic testing solutions for various infections, including COVID-19, flu, and RSV.",United States,[],[],[],"['https://www.usa.gov', '://', 'https://www.fda.gov', 'https://www.hhs.gov', 'https://covidtests.gov']",True,363.0
peachmeleggings.com,success,,"['leggings for women', 'free shipping on leggings', 'shop now pay later with afterpay', 'peach me leggings sets', ""women's legging sets online""]",Peach Me Leggings,"Leggings, Sets, Shorts, Flare Pants, Skirts, Tops, Bras, Pullover/Jacket, Long Sleeve Short Sleeve Tank Top One Pieces",Women seeking comfortable and affordable leggings and sets with free shipping options.,United States,[],[],[],"['https://www.amazon.com', 'https://www2.hm.com', 'https://www.underarmour.com', 'https://www.onlyleggings.com', 'https://www.wolford.com']",True,181.0
peachmode.com,success,,"['indian sarees online', 'saree collection india', 'banarasi silk sarees', 'kanjivaram silk sarees', 'kurtis for women online']",Peachmode,"Indian sarees, salwar suits, kurtis, tops & tunics, dresses, co-ords, wedding wear, party wear, ethnic wear",Women aged 18-45 seeking traditional Indian clothing for special occasions and daily wear,India,[],[],[],"['https://www.sujatra.com', 'https://www.myntra.com', 'https://houseofsadgi.com', 'https://shop369.in', 'https://devikatextiles.com']",True,222000.0
peachmodern.com,success,,"['vintage mid century furniture', 'modern design art collectibles', 'unique home decor items', 'furniture seating tables storage', 'industrial solid brass waste baskets']",Peach Modern,"vintage furniture, modern art, collectibles, home decor items, decorative accessories","Individuals and families seeking unique and high-end interior design pieces, primarily interested in mid-century and modern styles.",United States,[],[],[],"['https://apmidcenturymodern.com', 'https://vintage-mc.com', 'https://sunbeamvintage.com', 'https://www.1stdibs.com', 'https://midcenturywarehouse.com']",False,511.0
peachmountain.com,success,,"['world war ii aircraft', 'tank museums', 'history of fortifications', 'military aviation ww1', 'ww2 tanks and equipment']",Peachmountain.com,"History, Photos of Tanks, Fortifications, Ships and Planes, Books, Games, Essays, Travel, Tank Museums, Warships, Aircraft","Military enthusiasts, historians, and researchers interested in World War I and II, military aviation, and tank history, primarily located in the United States.",United States,[],['info@usaww1.com'],[],"['https://www.smithsonianmag.com', '://', 'https://en.wikipedia.org', 'https://www.si.edu', 'https://airandspace.si.edu']",False,0.0
peachofmind.com,success,,"['baby halloween costumes', 'halloween decorations on a budget', 'winnie the pooh baby shower decorations', 'easy ways to roast broccoli', 'patterned palazzo pants']",Peach of Mind,"lifestyle blog, parenting advice, home decor ideas","young mothers and families seeking lifestyle advice, particularly on parenting, home decor, and fashion",Georgia,[],[],[],"['https://stores.spirithalloween.com', 'https://www.temu.com', 'https://spearmintlove.com', 'https://www.lovejac.com', 'https://www.augustachronicle.com']",False,2210.0
peachonaleash.com,success,,"['dog training Atlanta', 'Atlanta dog trainers', 'in-home dog training', 'board and train dog programs', 'online dog training classes']",Peach on a Leash Dog Training and Behavior Services,"In-Home Private Dog Training, Board & Train, Group Classes, Online Dog Training, Puppy Training, Manners & Obedience, Aggression & Reactivity, Therapy Dog Training","Families with dogs in the Metro Atlanta area, seeking expert dog training and behavior services for puppies and adult dogs.","Alpharetta, Georgia; Serving Metro Atlanta and its northern suburbs",[],['info@peachonaleash.com'],[],"['https://dogtrainingelite.com', 'https://www.atlantadogtrainer.com', 'http://www.adtacademy.com', 'https://www.superiordogtraining.com', 'https://www.linkedin.com']",False,331.0
peachorchardapartments.com,success,,"['luxury apartments in Augusta GA', 'affordable luxury living in Augusta', 'apartments near Augusta Mall', 'pet friendly apartments in Augusta', 'apartments with pool in Augusta GA']",Peach Orchard Apartments,"apartments, floor plans, luxury living, affordable prices, swimming pool, computer lab, fitness center, dog park, play ground, picnic area with grills","Individuals and families seeking luxury apartments in Augusta, GA, with a focus on affordability, convenience, and amenities.","Augusta, GA 30906",[],['peachorchard@gatewaymgt.com'],[],"['https://www.apartments.com', 'https://www.zillow.com', 'https://www.rentcafe.com', 'https://www.apartmentlist.com', 'https://www.realtor.com']",True,0.0
peachpaperdesign.com,success,,"['custom stationery design', 'wedding invitation design services', 'small business branding solutions', 'watercolor wedding stationery', 'modern branding for entrepreneurs']",Peach Paper & Design,"Custom stationery, wedding invitations, small business branding",Thoughtful couples and creative entrepreneurs seeking unique design solutions for weddings and businesses.,United States,[],[],[],"['https://www.stationeryxpress.com', 'https://sugarpaper.com', 'https://www.moo.com', 'https://www.vistaprint.com', 'https://www.minted.com']",False,175.0
peachperfectskincare.com,success,,"['waxing services near me', 'Brazilian bikini wax West Hills CA', 'full body waxing studios in West Hills California', 'custom facial treatments West Hills', 'spa body treatments West Hills']",Peach Perfect,"Full Leg Waxing, Brazilian Bikini Wax, Eyebrow Waxing & Shaping, European Facials, Spa Body Treatments","Women and men seeking semi-permanent hair removal services, facials, and spa body treatments in West Hills, CA.","West Hills, CA",[],[],[''],"['https://www.fresha.com', 'https://www.groupon.com', 'https://locations.waxcenter.com', 'https://coconailspawesthills.com', 'https://brazilianhoneywaxing.com']",True,22.0
peachpitgym.com,success,,"['gymnastics classes atlanta', 'cheerleading teams near me', 'dance studios in atlanta ga', 'ninja training for kids', 'tumbling and trampoline classes']","The Peach Pit Gymnastcs, LLC","gymnastics classes, cheerleading teams, dance company, tumbling & trampoline, camps, private lessons, adult programming, toddler time/open play, birthday parties","Families with children aged 2-18, seeking gymnastics, cheerleading, and dance training in the Atlanta area.","Atlanta, Georgia",[],"['ssi@peachpitgym.com', 'dance@peachpitgym.com', 'theprado@peachpitgym.com', 'manager@peachpitgym.com']",[''],"['https://www.gymnasticsacademyofatlanta.com', 'https://atlantaschoolofgymnastics.net', 'http://buckheadgymnasticsandcheer.com', 'http://www.peachpitgym.com', 'http://www.atlantaschoolofgymnastics.net']",True,117.0
peachpitmusic.com,success,,"['indie rock band', 'new album magpie peach pit', 'peach pit music tour dates', 'alternative music artists from canada', 'indie pop songs on youtube']",Peach Pit,"Music, Merchandise, Tour Dates, Mailing List","Demographics: Fans of indie rock and alternative music, ages 18-35. Intent: Seeking new music releases, tour dates, and merchandise from emerging artists like Peach Pit.",Canada,[],[],[],"['https://en.wikipedia.org', 'https://www.last.fm', 'https://www.reddit.com', 'https://www.ranker.com', 'https://open.spotify.com']",False,545.0
peachpitpotteryshop.com,success,,"['handmade pottery', 'ceramic art for sale', 'custom pottery orders', 'unique home decor items', 'artist made ceramics']",Peach Pit Pottery Shop,"Handmade pottery, ceramic art, custom orders.","Individuals and families seeking unique, handmade home decor items and custom ceramic art for personal or special occasions.",United States,[],['info@peachpitpotteryshop.com'],[],"['https://emersoncreekpottery.com', 'https://jarsofdust.com', 'https://haand.us', 'https://www.etsy.com', 'https://blackoakart.com']",True,2.0
peach-pump.com,success,,"['gym clothing', 'yoga clothing', 'seamless leggings', 'sports bras', 'leggings sets']",Peach Pump,"Leggings, Gym leggings, Sports Bras, Tops, Jackets, Sport Sets, Shorts, Leggings sets, Accessories","Women seeking high-quality, comfortable, and performance-driven gym clothing and sports equipment for workouts and daily activities.",United States,[],[],[],['://'],True,3190.0
peachstatebasketball.com,success,,"['high school basketball showcases', 'basketball recruiting services', 'college exposure for high school athletes', ""women's basketball player rankings"", 'grassroots basketball tournaments']",Peach State Basketball,"basketball showcases, evaluation reports, film room evals, brand marketing profiles, college recruiting services",high school athletes and their families seeking college exposure and recruitment opportunities in women's basketball,Atlanta,[],[],[],"['https://hsallamerican.teamsportsadmin.com', 'https://www.southeastbasketballacademy.com', 'http://www.southeastbasketballacademy.com', 'https://basketballacademy.hawks.com', 'https://pgcbasketball.com']",False,955.0
peachstatecandlesupply.com,success,,"['candle making supplies online', 'fragrance oils for candle making', 'candle wax suppliers near me', 'wholesale candle making supplies usa', 'custom candle making materials']",Peach State Candle Supply,"Fragrance Oils, Candle Making Supplies, Tumblers, Room Spray/Body Spray Base, 17 oz Triple Wick Lid, Baccarat Rouge 540","Individuals and businesses seeking candle making supplies, including hobbyists, retailers, and entrepreneurs.",United States,[],[],[],"['https://candlewic.com', 'https://www.theflamingcandle.com', 'https://lonestarcandlesupply.com', 'https://www.americancandlesupplies.com', 'https://www.brambleberry.com']",True,313.0
peachstateco.com,success,,"['civil construction services', 'road construction companies', 'concrete installation contractors', 'licensed utility contractor', 'small business construction companies']",Peach State Construction Company,"Road construction, Concrete Installation, Civil Site development","Government Agencies and Private Companies seeking civil construction services in Covington, Georgia","Covington, Georgia",[],"['info@peachstateco.com', '770-788-6363info@peachstateco.com']",[''],"['http://www.braswellconstructiongroup.com', 'https://www.malcoconstructioninc.com', 'https://dhpbuilders.com', 'https://www.dnb.com', 'https://www.houzz.com']",False,8.0
