url,status,keywords,business_name,products_services,target_audience,location,headers,emails,phones,top_competitors,gmb_setup,non_indexed_pages,title,description,link,image,error
http://Sanjosebengalcats.com,success,"['Bengal kittens for sale', 'Exotic cat breeders San Jose CA', 'Bengal cats for adoption', 'Family friendly Bengal cats', 'Intelligent domestic cat breeds']",San Jose Bengal Cats,"Bengal kittens, Bengal adult cats, Pedigree Paperwork, health checked by a licensed veterinarian, 2 Year genetic health guarantee","Individuals and families seeking exotic feline companions with intelligence, playfulness, and affectionate nature.","San Jose, CA",[],['rene@sanjosebengalcats.com'],[],"['https://sanjosebengalcats.com', 'http://www.sanjosebengalcats.com', 'http://purrfectlyspottedbengals.com', 'https://thebengalconnection.com', 'https://sfbay.craigslist.org']",False,7440.0,,,,,
peachmarketplace.com,success,"['halloween t-shirts', 'fall apparel for women', 'leopard pumpkin shirt', 'embroidered halloween tops', 'halloween hoodies']",Peach Marketplace,"T-shirts, Hoodies, Sweatshirts, Embroidery Accessories, Tops and Dresses","Individuals seeking affordable, fashionable clothing for fall and Halloween, likely women aged 25-45 with a moderate to high disposable income.",United States,[],[],[],"['https://www.amazon.com', 'https://www.halloweenshirtcompany.com', 'https://oldnavy.gap.com', 'https://www.ebay.com', 'https://www.youtube.com']",True,349.0,,,,,
peachmcintyre.com,success,"['social media content creator', 'online income generation', 'content creator mentorship program', 'group mentorship for social media creators', 'turning internet into income']",Peach McIntyre Inc.,"Social Media Content Creator Mentorship Program, Online Income Generation Courses","Aspiring social media content creators seeking to generate online income, likely individuals aged 18-45 with a moderate level of online marketing knowledge and experience.",United States,[],"['support@peachmcintyre.com', 'Inc.813.797.1396support@peachmcintyre.com']",[''],"['https://www.upwork.com', 'https://www.linkedin.com', 'https://www.clickanalytic.com', 'https://www.indeed.com', 'https://www.firstpointusa.com']",True,160.0,,,,,
peachmedical.com,success,"['covid-19 test kits', 'at-home antigen tests', 'point-of-care testing products', 'over-the-counter covid-19 test', 'rapid antigen test kits']",Peach Medical,"Lucira, BinaxNow, QuickVue, Indicaid, Point of Care Products (POCT), Over The Counter Antigen Test Kits, COVID-19 test kits, At-home antigen tests",Healthcare professionals and individuals seeking rapid diagnostic testing solutions for COVID-19 and other infections.,United States,[],[],[],"['https://www.usa.gov', '://', 'https://www.fda.gov', 'https://www.thermofisher.com', 'https://www.hhs.gov']",True,439.0,,,,,
peachmeleggings.com,success,"['leggings online shopping', 'free shipping leggings', 'affordable loungewear', ""women's comfortable clothing"", 'shop now pay later']",Peach Me Leggings,"leggings, shorts, flare pants, tops, bras, pull-over jacket, long sleeve shirt, short sleeve shirt, tank top, one piece, size chart, merchandise","Women seeking affordable and comfortable clothing options, aged 18-45, with a focus on relaxation and self-care.",United States,[],[],[],"['https://www.creationl.com', 'https://clssportswear.com', 'https://www.onlyleggings.com', 'https://twinbirds.co.in', 'https://www.spiritualwarrior.in']",True,386.0,,,,,
peachmode.com,success,"['indian clothing online', 'bollywood sarees wholesale', 'kanjivaram silk sarees', 'banarasi silk salwar kameez', 'chiffon party wear dresses']",Peachmode,"sarees, salwar suits, kurtis, tops & tunics, dresses, co-ords, fabrics, kurti pant sets, palazzo suit tops, dhoti sets","Individuals and families from diverse regions including India, Australia, Austria, Belgium, Canada, Czechia, Denmark, Fiji, Finland, France, Germany, Hong Kong SAR, Ireland, Israel, Italy, Japan, Kuwait, Malaysia, Mauritius, Netherlands, New Zealand, Norway, Poland, Portugal, Qatar, Saudi Arabia, Singapore, South Africa, Spain, Sri Lanka, Sweden, Switzerland, Thailand, United Arab Emirates, United Kingdom, United States, Vietnam seeking ethnic wear and party dresses",India,[],[],[],"['https://www.myntra.com', 'https://www.kalkifashion.com', 'https://www.anitadongre.com', 'https://www.gulabojaipur.com', 'https://www.biba.in']",True,220000.0,,,,,
peachmodern.com,success,"['vintage industrial furniture', 'mid century modern decor', 'art collectibles for sale', 'unique furniture pieces online', 'high-end home decor items']",Peach Modern,"Furniture, art, and collectibles",High-end consumers seeking unique and vintage decorative items for their homes,United States,[],[],[],"['https://www.retro.net', 'https://shop.retro.net', 'https://steelvintage.com', 'https://www.vintagemillwerks.com', 'https://www.linkedin.com']",False,424.0,,,,,
peach-momo.com,success,[],,,,,[],[],[],"['https://www.odoo.com', 'https://community.dynamics.com', 'https://docs.revenera.com', 'https://www.reddit.com', 'https://help.shopify.com']",True,1.0,2021 年产品测试和评估 - 最佳现在,查看我们的实验室测试结果，了解哪些商品推荐给您。,https://www.reviewed.com/home-products/best-product-awards,https://cdn1.imggmi.com/uploads/2020/12/17/d8e4f3b2c5a6d9f7bfcd6da1ca8d6aee.jpg,
peachmountain.com,success,"['world war i aircraft', 'world war ii tanks', 'cold war military history', 'tank museums saumur fort knox aberdeen ottawa moscow st petersburg', 'military aviation in world war one']",Peachmountain.com,"tank museums, aircraft photos, warships, essays, games, books, travel guides","history enthusiasts, military buffs, researchers, educators, students interested in World War I and II history, aviation, and tank technology",United States,[],['info@usaww1.com'],[],"['https://en.wikipedia.org', 'https://www.militaryaviationmuseum.org', 'https://www.history.navy.mil', 'https://www.militaryfactory.com', 'https://www.nationalmuseum.af.mil']",False,364.0,,,,,
peachmusic.com,success,"['Bengal kittens for sale near me', 'adopt a Bengal cat in Florida', 'Bengal kitten breeders USA', 'Bengal adult cats for adoption', 'Bengal cat rescue organizations']",Peach Music,"Piano lessons, guitar lessons, music theory classes, music recording studio, audio equipment rentals","Individuals and families seeking music education services in Florida, including piano and guitar students of all ages.",United States,[],[],[],"['https://wildnsweetbengals.com', 'https://thebengalconnection.com', 'https://www.risingsunfarm.com', 'https://mirabellbengals.com', 'http://floridabengals.com']",False,116.0,,,,,
peachmyk.com,success,"['hk fashion online shopping', 'korean fashion brand hk', 'airpods pro case hk', 'hk kpop merchandise online', 'korean clothing store hk']",Peachmyk,"Korean fashion, Korean accessories, AirPods Pro cases, K-pop merchandise","Hong Kong residents interested in K-pop culture and fashion, aged 15-40, with a focus on young adults.",Hong Kong,[],[],[],"['https://www.zalora.com.hk', 'https://expatliving.hk', 'https://www.sassyhongkong.com', 'https://www.maje.com.hk', 'https://ka-pok.com']",False,0.0,,,,,
peachofmind.com,success,"['cute halloween costumes for babies', 'halloween decorations on a budget', 'winnie the pooh baby shower decorations', 'easy ways to roast broccoli', 'patterned palazzo pants']",Peach of Mind,"lifestyle blog, halloween costumes, party decorations, melamine dinnerware, clothing",new mothers and young families seeking style and decorating inspiration for their homes and babies,Georgia,[],[],[],"['https://www.lovejac.com', 'https://www.hgtv.com', 'https://www.happiestbaby.com', 'https://www.youtube.com', 'https://www.pinterest.com']",False,2210.0,,,,,
peachonaleash.com,success,"['dog training atlanta', 'atlanta dog trainers near me', 'in-home dog training north georgia', 'board and train dogs atlanta', 'private dog training alpharetta ga']",Peach on a Leash Dog Training and Behavior Services,"In-Home Private Dog Training, Board & Train, Group Classes, Online Dog Training","Families in the North Atlanta area seeking effective and humane dog training solutions for puppies, adult dogs, and therapy dogs.","Alpharetta, Georgia, serving Metro Atlanta and its northern suburbs",[],['info@peachonaleash.com'],[],"['https://dogtrainingelite.com', 'https://www.atlantadogtrainer.com', 'https://www.superiordogtraining.com', 'https://marketplace.akc.org', 'https://www.linkedin.com']",False,260.0,,,,,
peachorchardapartments.com,success,"['peach orchard apartments augusta ga', 'apartments in augusta ga 30906', 'luxury living at affordable prices', 'apartment complexes near augusta mall', 'senior living communities in augusta ga']",Peach Orchard Apartments,"Apartments, Luxury Living at Affordable Prices","Individuals and families seeking apartments in Augusta, GA, prioritizing convenience and amenities.","Augusta, Georgia",[],['peachorchard@gatewaymgt.com'],[],"['https://www.peachorchardapartments.com', 'https://www.apartments.com', 'https://www.apartmentguide.com', 'https://www.rent.com', 'https://www.augustametrochamber.com']",True,0.0,,,,,
peachpalettedesign.com,error,,,,,,,,,,,,,,,,"Error scraping https://peachpalettedesign.com: HTTPSConnectionPool(host='peachpalettedesign.com', port=443): Max retries exceeded with url: / (Caused by NameResolutionError(""<urllib3.connection.HTTPSConnection object at 0x7f1af3402050>: Failed to resolve 'peachpalettedesign.com' ([Errno -2] Name or service not known)""))"
peachpaperdesign.com,success,"['custom wedding invitation design', 'small business branding services', 'wedding stationery creation', 'graphic design for small businesses', 'watercolor wedding invitations']",Peach Paper & Design,"Custom stationery, branding services, print shop products (e.g. 'dibs', wildflower prints), wedding invitation design, small business branding.",Creative individuals and small businesses seeking custom graphic design and branding solutions for their weddings or professional brands.,United States,[],[],[],"['https://www.shutterfly.com', 'https://www.basicinvite.com', 'https://lilyandroeco.com', 'https://www.minted.com', 'https://www.vivahcards.com']",False,120.0,,,,,
peachpeonyfashion.com,error,,,,,,,,,,,,,,,,"Error scraping https://peachpeonyfashion.com: HTTPSConnectionPool(host='peachpeonyfashion.com', port=443): Max retries exceeded with url: / (Caused by NameResolutionError(""<urllib3.connection.HTTPSConnection object at 0x7f1af399e560>: Failed to resolve 'peachpeonyfashion.com' ([Errno -2] Name or service not known)""))"
peachperfectskincare.com,success,"['Brazilian bikini wax near me', 'custom facials West Hills CA', 'full body waxing services', 'spa body treatments Los Angeles', 'waxing and skincare studios']",Peach Perfect,"Full Leg Waxing, Brazilian Bikini Wax, Eyebrow Waxing & Shaping, European Facials, Spa Body Treatments","Women seeking waxing services and skincare treatments in the West Hills, CA area","West Hills, CA",[],[],[''],"['https://www.fresha.com', 'https://www.groupon.com', 'https://locations.waxcenter.com', 'http://peachperfectwaxing.com', 'https://square.site']",True,22.0,,,,,
peachpiepups.com,error,,,,,,,,,,,,,,,,"Error scraping https://peachpiepups.com: HTTPSConnectionPool(host='peachpiepups.com', port=443): Max retries exceeded with url: / (Caused by NameResolutionError(""<urllib3.connection.HTTPSConnection object at 0x7f1af2af7e50>: Failed to resolve 'peachpiepups.com' ([Errno -2] Name or service not known)""))"
peachpitgym.com,success,"['gymnastics classes near me', 'cheerleading gym in Atlanta GA', 'dance studios in St Simons Island GA', 'tumbling and trampoline training for kids', 'competitive gymnastics teams in Georgia']","The Peach Pit Gymnastics, LLC","gymnastics classes, cheerleading gym, dance company, tumbling & trampoline, competitive teams, camps, private lessons, adult programming, toddler time/open play, gift cards, birthday parties","Parents and children seeking gymnastics, cheerleading, and dance instruction in the Atlanta area, specifically families with kids aged 2-18.","Atlanta, Georgia",[],"['manager@peachpitgym.com', 'dance@peachpitgym.com', 'ssi@peachpitgym.com', 'theprado@peachpitgym.com']",[''],"['http://www.peachpitgym.com', 'http://buckheadgymnasticsandcheer.com', 'http://www.atlantaschoolofgymnastics.net', 'https://www.gymnasticsacademyofatlanta.com', 'https://atlantaschoolofgymnastics.net']",True,78.0,,,,,
peachpitmusic.com,success,"['indie rock music band peach pit', 'canadian indie rock music bands', 'peach pit tour dates', 'new album magpie peach pit', 'peach pit merch store']",Peach Pit,"music albums, tour merchandise",Indie music fans aged 18-35 interested in Canadian rock bands and live concert experiences.,Canada,[],[],[],"['https://en.wikipedia.org', '://', 'https://www.youtube.com', 'https://www.peachpitmusic.com', 'https://music.apple.com']",False,530.0,,,,,
